{
  "data_as_of": "2026-09-08",
  "generated_by": "scripts/build_w033_content_corpus.py",
  "method_note": "Content is copied from existing normalized documentary extractions; original preserved files prevail.",
  "schema_version": "1.0.0",
  "sources": [
    {
      "applicability": "indeterminate",
      "applicability_note": "Applicability to curriculum 2023: indeterminado. Normalized whitespace/line breaks only; source states `CH Total: 60h`, stored as numeric 60 to follow the W018/W019 field structure. PDF is published in a 2024 directory; applicability remains indeterminado.",
      "component_code": "BF114",
      "component_instance_id": "curriculum-2023-bf114",
      "curriculum_id": "curriculum-2023",
      "document": {
        "document_date": "not stated",
        "document_type": "Ficha 1",
        "id": "document-bf114-ficha-1",
        "institution": "Universidade Federal do Paraná",
        "original_url": "https://bio.ufpr.br/fisiologia/wp-content/uploads/sites/37/2024/12/1141.pdf",
        "repository_path": "curriculos/2023/fichas/outros-departamentos/BF114-ficha-1.pdf",
        "sha256": "405e9838e92b73ca318b66a9c5d47a7aed8e382bb64ee6d5b340bb3110e2300f",
        "title": "Fisiologia para Informática Biomédica"
      },
      "documentary_state": "indeterminate",
      "id": "corpus-bf114-ficha-1",
      "occurrence_eligible": true,
      "sections": [
        {
          "kind": "ementa",
          "locator": "PDF p. 2, section heading `EMENTA`, paragraph below heading",
          "text": "Análise dos mecanismos que regulam a atividade funcional da célula e dos diferentes sistemas que participam da homeostasia do meio interno. Fisiologia dos líquidos corporais e as bases fisiológicas do transporte através de membranas. Fisiologia dos sistemas: Locomotor, cardiovascular, renal, respiratório e digestivo. Fisiologia das Glândulas Endócrinas com a respectiva função dos seus diferentes hormônios. Neurofisiologia: Sistema Nervoso Central, Sistema nervoso periférico, neurovegetativo, circuitos neuronais, neurotransmissão. Fundamentos fisiológicos para elaboração de simulações de computador."
        }
      ]
    },
    {
      "applicability": "indeterminate",
      "applicability_note": "Applicability to curriculum 2023: indeterminado. Normalized whitespace/line breaks only; source PDF prevails. Applicability remains indeterminado; manifest notes the PDF's 2022 signature/rendering dates and no separate 2023 applicability act is used here.",
      "component_code": "BQ083",
      "component_instance_id": "curriculum-2023-bq083",
      "curriculum_id": "curriculum-2023",
      "document": {
        "document_date": "not stated",
        "document_type": "Ficha 1",
        "id": "document-bq083-ficha-1",
        "institution": "Universidade Federal do Paraná",
        "original_url": "https://bio.ufpr.br/bioquimica/wp-content/uploads/sites/31/2021/12/BQ083-FICHA-1.pdf",
        "repository_path": "curriculos/2023/fichas/outros-departamentos/BQ083-ficha-1.pdf",
        "sha256": "65c7e762dd3e2587bee40187a0fdb690d60fd9f085b737b566b2439e95af5109",
        "title": "Biologia Molecular e Bioinformática"
      },
      "documentary_state": "indeterminate",
      "id": "corpus-bq083-ficha-1",
      "occurrence_eligible": true,
      "sections": [
        {
          "kind": "ementa",
          "locator": "PDF p. 1, section heading `EMENTA (Unidade Didática)`, two paragraphs below heading",
          "text": "Estrutura ácidos nucléicos; fluxo informacional em sistemas biológicos: replicação, transcrição, tradução, regulação da expressão gênica; princípios de manipulação gênica; aplicações biotecnológicas da biologia molecular; teoria e prática da manipulação de moléculas de DNA. Banco de dados biológicos; algoritmos de alinhamento de sequências e busca de genes; análise filogenética; análise Genômica, Transcriptômica e Proteômica; análise de macromoléculas in silico; Biologia de Sistemas e aplicações da Bioinformática na pesquisa biológica."
        }
      ]
    },
    {
      "applicability": "indeterminate",
      "applicability_note": "Applicability to curriculum 2023: indeterminado. Normalized spacing/line breaks only; source PDF prevails; applicability remains indeterminado because the PDF predates the 2023 reform and no continuity act is established here.",
      "component_code": "CI1001",
      "component_instance_id": "curriculum-2023-ci1001",
      "curriculum_id": "curriculum-2023",
      "document": {
        "document_date": "not stated",
        "document_type": "Ficha 1",
        "id": "document-ci1001-ficha-1",
        "institution": "Universidade Federal do Paraná",
        "original_url": "https://web.inf.ufpr.br/dinf/wp-content/uploads/sites/2/2020/05/CI1001-Programa%C3%A7%C3%A3o-1.pdf",
        "repository_path": "curriculos/2023/fichas/dinf/CI1001/ficha-1.pdf",
        "sha256": "de98f9b0340f8243d9f8f1f8eb9f0ef76a63ced54fd2088f915709281fa4dbb8",
        "title": "Programação 1"
      },
      "documentary_state": "indeterminate",
      "id": "corpus-ci1001-ficha-1",
      "occurrence_eligible": true,
      "sections": [
        {
          "kind": "ementa",
          "locator": "PDF p. 1, section heading `EMENTA`, paragraph below heading",
          "text": "Uso dirigido de ferramentas para programação. Estudo de estruturas de dados básicas. Práticas de programação."
        }
      ]
    },
    {
      "applicability": "indeterminate",
      "applicability_note": "Applicability to curriculum 2023: indeterminado; Ficha 2 is offering-specific. Whitespace and ligature normalization only; source pagination/footer excluded.",
      "component_code": "CI1001",
      "component_instance_id": "curriculum-2023-ci1001",
      "curriculum_id": "curriculum-2023",
      "document": {
        "document_date": "not stated",
        "document_type": "Ficha 2",
        "id": "document-ci1001-ficha-2",
        "institution": "Universidade Federal do Paraná",
        "original_url": "https://web.inf.ufpr.br/dinf/wp-content/uploads/sites/2/2020/05/2CI1001-Programa%C3%A7%C3%A3o-1.pdf",
        "repository_path": "curriculos/2023/fichas/dinf/CI1001/ficha-2.pdf",
        "sha256": "84c915a688a91dbd12a2dc5b02880a9e527794e8fdbf93593a6c020fd46253ab",
        "title": "Programação 1"
      },
      "documentary_state": "indeterminate",
      "id": "corpus-ci1001-ficha-2",
      "occurrence_eligible": true,
      "sections": [
        {
          "kind": "ementa",
          "locator": "identity/permanent fields/ementa/program: PDF p. 1; objectives/method/evaluation: PDF pp. 1-2; bibliography: PDF pp. 2-3; teacher/signature: PDF p. 3",
          "text": "Uso dirigido de ferramentas para programação. Estudo de estruturas de dados básicas. Práticas de programação."
        },
        {
          "kind": "program",
          "locator": "identity/permanent fields/ementa/program: PDF p. 1; objectives/method/evaluation: PDF pp. 1-2; bibliography: PDF pp. 2-3; teacher/signature: PDF p. 3",
          "text": "1. Introdução ao sistema Linux. Comandos básicos 2. Ferramentas para apoio à programação em Linux (scripts, sed, awk, dentre outros) 3. Introdução à Linguagem C (migração de Pascal para C) 4. Registros (struct) e Enumeração. 5. Ponteiros e alocação dinâmica de memória, incluindo aritmética de ponteiros. 6. Estruturas de dados fundamentais. Tipos de dados, estruturas de dados e tipos abstratos de dados. 7. Estruturas de dados na memória principal: uso de alocação estática e dinâmica de memória. 8. Listas lineares e suas especializações: listas ordenadas, listas encadeadas, ﬁlas e pilhas. Aplicações de listas. 9. Implementação de listas, pilhas e ﬁlas em linguagem C 10. Métodos básicos de teste de código e depuração."
        },
        {
          "kind": "objectives",
          "locator": "identity/permanent fields/ementa/program: PDF p. 1; objectives/method/evaluation: PDF pp. 1-2; bibliography: PDF pp. 2-3; teacher/signature: PDF p. 3",